{
  "schema_version": 1,
  "id": "cluster:programming",
  "name": "Space programming",
  "maintainer": "Arch Studio maintainers",
  "scope": "Workplace programs and occupancy calculation procedures.",
  "members": [
    "skill:workplace-programmer",
    "skill:occupancy-calculator",
    "studio:workspace-contract",
    "knowledge:sources",
    "knowledge:jurisdictions"
  ],
  "dependencies": [],
  "coverage": {
    "jurisdictions": [
      "jurisdiction:us-ny-nyc"
    ],
    "limitations": "The NYC Construction Codes index is linked for jurisdiction-checked occupancy work; it is not a selected edition, occupant-load table or general geographic coverage guarantee. Workplace programming remains a general procedure. No cluster-wide executable calculation or validated workflow is claimed.",
    "sources_indexed": true,
    "procedures_available": true,
    "execution_implemented": false,
    "workflow_validated": false
  },
  "host_requirements": [
    "agent instruction following",
    "read resources",
    "skill-specific tools and authorized workspace access when required"
  ],
  "evaluations": [
    {
      "id": "programming-discovery",
      "kind": "contract",
      "path": "tests/test-category-contracts.sh",
      "claim": "Manifest membership and portability only; not workflow acceptance"
    },
    {
      "id": "programming-source-membership",
      "kind": "contract",
      "path": "tests/test-category-source-integration.sh",
      "claim": "Shared source dependencies and truthful cluster declarations only; not workflow validation"
    }
  ],
  "reviewed_on": "2026-09-05"
}
