{
  "schema_version": 1,
  "id": "cluster:code-regulatory",
  "name": "Code & Regulatory",
  "maintainer": "Architecture Studio maintainers",
  "scope": "Atomic NYC regulatory reference lookup, with explicitly maintained federal and New York State dependencies; routing and evidence, not compliance certification.",
  "members": [
    "skill:nyc-building-code",
    "skill:nyc-existing-building-code",
    "skill:nyc-plumbing-code",
    "skill:nyc-mechanical-code",
    "skill:nyc-fuel-gas-code",
    "skill:nyc-construction-administration",
    "skill:nyc-electrical-code",
    "skill:nyc-fire-code",
    "skill:nyc-fdny-rule",
    "skill:nyc-energy-code",
    "skill:nyc-ll97-applicability",
    "skill:nyc-emissions-limit",
    "skill:nyc-zoning-provision",
    "skill:nyc-housing-maintenance",
    "skill:nyc-multiple-dwelling-law",
    "skill:nyc-noise-requirement",
    "skill:nyc-asbestos-requirement",
    "skill:nyc-air-emissions-requirement",
    "skill:nyc-stormwater-requirement",
    "skill:nyc-sewer-requirement",
    "skill:nyc-hazardous-material-requirement",
    "skill:nyc-accessibility-requirement",
    "skill:ada-requirement",
    "skill:nyc-lpc-requirement",
    "skill:nyc-sidewalk-requirement",
    "skill:nyc-curb-cut-requirement",
    "skill:nyc-plaza-requirement",
    "skill:nyc-street-tree-requirement",
    "skill:nyc-utility-connection-requirement",
    "skill:nyc-material-requirement",
    "skill:nyc-interior-finish-requirement",
    "skill:nyc-floor-finish-requirement",
    "skill:nyc-furnishing-requirement",
    "skill:nyc-drapery-requirement",
    "skill:nyc-local-law",
    "skill:nyc-agency-rule",
    "skill:nyc-buildings-bulletin",
    "skill:nyc-code-note",
    "skill:nyc-executive-order",
    "skill:nyc-certificate-of-occupancy",
    "skill:nyc-authority-resolver",
    "skill:nyc-code-edition",
    "skill:nyc-code-section",
    "skill:nyc-amendment-check",
    "skill:nyc-referenced-standard",
    "skill:nyc-bsa",
    "skill:nyc-acris",
    "skill:nyc-dob-permits",
    "skill:nyc-dob-violations",
    "skill:nyc-hpd",
    "skill:nyc-landmarks",
    "skill:nyc-property-report",
    "skill:zoning-analysis-nyc",
    "skill:zoning-envelope",
    "knowledge:nyc-sources",
    "knowledge:jurisdictions"
  ],
  "dependencies": [],
  "coverage": {
    "jurisdictions": [
      "jurisdiction:us-ny-nyc"
    ],
    "limitations": "N01–N13 procedure inventory. Source identity, rights, edition and applicability remain qualified per receipt. Metadata-only or inaccessible material is not provision coverage. Independent specialist and four-host workflow acceptance are pending; no other city coverage is claimed.",
    "sources_indexed": true,
    "procedures_available": true,
    "execution_implemented": false,
    "workflow_validated": false
  },
  "host_requirements": [
    "Read exact-release corpus resources",
    "An available permitted source lookup integration for actual retrieval",
    "No local workspace required for public lookup; separate grant only for explicit project persistence"
  ],
  "evaluations": [
    {
      "id": "nyc-code-routing-contracts",
      "kind": "contract",
      "path": "tests/fixtures/nyc-code-routes.json",
      "claim": "Frozen positive/negative routing expectations, not executed host evidence"
    }
  ],
  "reviewed_on": "2026-09-06"
}
